{
    "$schema": "http://json-schema.org/draft-07/schema#",
    "definitions": {
        "ExternalRequirement": {
            "properties": {
                "href": {
                    "items": [
                        {
                            "type": "string"
                        }
                    ],
                    "maxItems": 1,
                    "minItems": 1,
                    "type": "array"
                },
                "id": {
                    "type": "string"
                },
                "site": {
                    "type": "string"
                },
                "type": {
                    "enum": [
                        "external"
                    ],
                    "type": "string"
                }
            },
            "type": "object"
        },
        "InternalRequirement": {
            "properties": {
                "id": {
                    "type": "string"
                },
                "type": {
                    "enum": [
                        "internal"
                    ],
                    "type": "string"
                }
            },
            "type": "object"
        },
        "ProductMedia": {
            "properties": {
                "banner": {
                    "type": "string"
                },
                "gallery": {
                    "items": {
                        "type": "string"
                    },
                    "type": "array"
                },
                "videos": {
                    "items": {
                        "type": "string"
                    },
                    "type": "array"
                }
            },
            "type": "object"
        }
    },
    "properties": {
        "baseUrl": {
            "type": "string"
        },
        "children": {
            "items": [
                {
                    "type": "string"
                }
            ],
            "maxItems": 1,
            "minItems": 1,
            "type": "array"
        },
        "coverImage": {
            "type": "string"
        },
        "created": {
            "type": "string"
        },
        "description": {
            "type": "string"
        },
        "excerpt": {
            "type": "string"
        },
        "fileName": {
            "type": "string"
        },
        "files": {
            "properties": {
                "other": {
                    "description": "Miscellaneous files belonging to the product",
                    "items": {
                        "properties": {
                            "slug": {
                                "type": "string"
                            },
                            "tag": {
                                "enum": [
                                    "manual",
                                    "misc"
                                ],
                                "type": "string"
                            }
                        },
                        "type": "object"
                    },
                    "type": "array"
                },
                "primary": {
                    "description": "Primary file ID",
                    "type": "string"
                }
            },
            "type": "object"
        },
        "id": {
            "type": "string"
        },
        "media": {
            "$ref": "#/definitions/ProductMedia"
        },
        "modified": {
            "type": "string"
        },
        "name": {
            "type": "string"
        },
        "parent": {
            "type": "string"
        },
        "public": {
            "type": "boolean"
        },
        "published": {
            "format": "date-time",
            "type": "string"
        },
        "requirements": {
            "items": {
                "anyOf": [
                    {
                        "$ref": "#/definitions/ExternalRequirement"
                    },
                    {
                        "$ref": "#/definitions/InternalRequirement"
                    }
                ]
            },
            "type": "array"
        },
        "similar": {
            "items": [
                {
                    "type": "string"
                }
            ],
            "maxItems": 1,
            "minItems": 1,
            "type": "array"
        },
        "slug": {
            "type": "string"
        },
        "thumbnail": {
            "type": "string"
        }
    },
    "type": "object"
}

